{"timestamp": "2026-08-06T07:09:06", "commit": "3b7b82d", "branch": "testing1", "note": "B5 drop VE + reinvest ASPECT_RATIO=128", "status": "discard", "seed": 42, "val_bpb": 1.1894971851798617, "training_seconds": 300.41293692588806, "startup_seconds": 1.3951072692871094, "mfu_percent": 35.68391164523915, "total_tokens_M": 133.955584, "num_steps": 511, "depth": 3, "num_params": 11599878, "num_params_M": 11.599878, "peak_vram_mb": 16992.68505859375, "total_seconds": 339.63031244277954, "peak_vram_gb": 16.59441900253296, "score": 1.1894971851798617, "goal": "min_bpb", "time_budget": 300, "eval_tokens": 20971520}
{"timestamp": "2026-08-06T07:16:09", "commit": "7e30bfc", "branch": "testing1", "note": "B4 tied embeddings", "status": "discard", "seed": 42, "val_bpb": 2.7083234577914372, "training_seconds": 300.37173557281494, "startup_seconds": 1.352097749710083, "mfu_percent": 20.92639168449122, "total_tokens_M": 184.025088, "num_steps": 702, "depth": 3, "num_params": 8650886, "num_params_M": 8.650886, "peak_vram_mb": 13249.54541015625, "total_seconds": 333.7913661003113, "peak_vram_gb": 12.939009189605713, "score": 2.7083234577914372, "goal": "min_bpb", "time_budget": 300, "eval_tokens": 20971520}
{"timestamp": "2026-08-06T07:23:05", "commit": "5990704", "branch": "testing1", "note": "B4 tied embeddings", "status": "discard", "seed": 42, "val_bpb": 2.6433694908927055, "training_seconds": 300.20667362213135, "startup_seconds": 1.3926968574523926, "mfu_percent": 20.986738990995917, "total_tokens_M": 184.025088, "num_steps": 702, "depth": 3, "num_params": 8650886, "num_params_M": 8.650886, "peak_vram_mb": 13249.54541015625, "total_seconds": 327.351202249527, "peak_vram_gb": 12.939009189605713, "score": 2.6433694908927055, "goal": "min_bpb", "time_budget": 300, "eval_tokens": 20971520}
{"timestamp": "2026-08-06T07:30:39", "commit": "56f85b4", "branch": "testing1", "note": "B4 tied embeddings", "status": "discard", "seed": 42, "val_bpb": 1.2308976256419462, "training_seconds": 300.40725564956665, "startup_seconds": 1.3608405590057373, "mfu_percent": 20.837060320524426, "total_tokens_M": 183.762944, "num_steps": 701, "depth": 3, "num_params": 8650886, "num_params_M": 8.650886, "peak_vram_mb": 13249.54541015625, "total_seconds": 327.44539070129395, "peak_vram_gb": 12.939009189605713, "score": 1.2308976256419462, "goal": "min_bpb", "time_budget": 300, "eval_tokens": 20971520}
{"timestamp": "2026-08-06T07:39:02", "commit": "8f0d5ce", "branch": "testing1", "note": "B4 tied embeddings + reinvest ASPECT_RATIO=96", "status": "discard", "seed": 42, "val_bpb": 1.194603502081243, "training_seconds": 300.1593105792999, "startup_seconds": 1.5956904888153076, "mfu_percent": 26.607276343619144, "total_tokens_M": 130.285568, "num_steps": 497, "depth": 3, "num_params": 14745798, "num_params_M": 14.745798, "peak_vram_mb": 17786.9384765625, "total_seconds": 343.3011667728424, "peak_vram_gb": 17.370057106018066, "score": 1.194603502081243, "goal": "min_bpb", "time_budget": 300, "eval_tokens": 20971520}
{"timestamp": "2026-08-06T07:45:49", "commit": "3010f51", "branch": "testing1", "note": "A4 baseline budget=300", "status": "discard", "seed": 42, "val_bpb": 1.354050832414135, "training_seconds": 300.31421875953674, "startup_seconds": 1.3411927223205566, "mfu_percent": 29.340506123242694, "total_tokens_M": 150.7328, "num_steps": 575, "depth": 4, "num_params": 11534472, "num_params_M": 11.534472, "peak_vram_mb": 15855.05810546875, "total_seconds": 330.73415517807007, "peak_vram_gb": 15.483455181121826, "score": 1.354050832414135, "goal": "min_bpb", "time_budget": 300, "eval_tokens": 20971520}
{"timestamp": "2026-08-06T08:29:17", "commit": "3010f51", "branch": "testing1", "note": "A4 baseline budget=900", "status": "discard", "seed": 42, "val_bpb": 1.343788821120422, "training_seconds": 900.4209110736847, "startup_seconds": 1.5292880535125732, "mfu_percent": 15.142254222962364, "total_tokens_M": 230.68672, "num_steps": 880, "depth": 4, "num_params": 11534472, "num_params_M": 11.534472, "peak_vram_mb": 15855.05810546875, "total_seconds": 948.1973929405212, "peak_vram_gb": 15.483455181121826, "score": 1.343788821120422, "goal": "min_bpb", "time_budget": 900, "eval_tokens": 20971520}
{"timestamp": "2026-08-06T13:48:14", "commit": "fbf8e31", "branch": "HEAD", "note": "A4 winner budget=300", "status": "keep", "seed": 42, "val_bpb": 1.2137983004182615, "training_seconds": 300.44343638420105, "startup_seconds": 1.3015756607055664, "mfu_percent": 22.14824218729088, "total_tokens_M": 142.86848, "num_steps": 545, "depth": 3, "num_params": 10748038, "num_params_M": 10.748038, "peak_vram_mb": 13023.54541015625, "total_seconds": 343.52145552635193, "peak_vram_gb": 12.718306064605713, "score": 1.2137983004182615, "goal": "min_bpb", "time_budget": 300, "eval_tokens": 20971520}
{"timestamp": "2026-08-06T14:06:39", "commit": "fbf8e31", "branch": "HEAD", "note": "A4 winner budget=900", "status": "keep", "seed": 42, "val_bpb": 1.1494371605320972, "training_seconds": 900.3223614692688, "startup_seconds": 2.2711355686187744, "mfu_percent": 63.80000480978628, "total_tokens_M": 504.6272, "num_steps": 1925, "depth": 3, "num_params": 10748038, "num_params_M": 10.748038, "peak_vram_mb": 13023.54541015625, "total_seconds": 937.2890777587891, "peak_vram_gb": 12.718306064605713, "score": 1.1494371605320972, "goal": "min_bpb", "time_budget": 900, "eval_tokens": 20971520}
