{"timestamp": "2026-08-03T21:46:25", "commit": "4ddc894", "branch": "main", "note": "", "status": "pending", "val_bpb": 1.4386420440792758, "training_seconds": 303.0687940120697, "startup_seconds": 1.0410516262054443, "mfu_percent": 3.3438225787599887, "total_tokens_M": 47.18592, "num_steps": 90, "depth": 8, "num_params": 50332176, "num_params_M": 50.332176, "peak_vram_mb": 51011.208984375, "total_seconds": 426.38862895965576, "peak_vram_gb": 49.81563377380371, "score": 1.4386420440792758, "goal": "min_bpb"}
{"timestamp": "2026-08-03T22:20:07", "commit": "0052cdd", "branch": "uv-update", "note": "", "status": "pending", "val_bpb": 1.3356181924654988, "training_seconds": 300.3391327857971, "startup_seconds": 1.877488136291504, "mfu_percent": 28.549134446482903, "total_tokens_M": 152.567808, "num_steps": 582, "depth": 4, "num_params": 11534472, "num_params_M": 11.534472, "peak_vram_mb": 15855.05810546875, "total_seconds": 348.0090272426605, "peak_vram_gb": 15.483455181121826, "score": 1.3356181924654988, "goal": "min_bpb"}
{"timestamp": "2026-08-04T08:39:08", "commit": "3010f51", "branch": "testing1", "note": "A1 seed 41", "status": "pending", "seed": 41, "val_bpb": 1.3434640879202229, "training_seconds": 300.2044632434845, "startup_seconds": 1.3357553482055664, "mfu_percent": 28.57599669175077, "total_tokens_M": 152.829952, "num_steps": 583, "depth": 4, "num_params": 11534472, "num_params_M": 11.534472, "peak_vram_mb": 15855.05810546875, "total_seconds": 330.29997968673706, "peak_vram_gb": 15.483455181121826, "score": 1.3434640879202229, "goal": "min_bpb", "time_budget": 300, "eval_tokens": 20971520}
{"timestamp": "2026-08-04T13:03:54", "commit": "3010f51", "branch": "testing1", "note": "A1 seed 42", "status": "pending", "seed": 42, "val_bpb": 1.3410594831302718, "training_seconds": 300.19576358795166, "startup_seconds": 1.2811219692230225, "mfu_percent": 28.664366988632054, "total_tokens_M": 151.519232, "num_steps": 578, "depth": 4, "num_params": 11534472, "num_params_M": 11.534472, "peak_vram_mb": 15855.05810546875, "total_seconds": 330.6292748451233, "peak_vram_gb": 15.483455181121826, "score": 1.3410594831302718, "goal": "min_bpb", "time_budget": 300, "eval_tokens": 20971520}
{"timestamp": "2026-08-04T13:29:42", "commit": "3010f51", "branch": "testing1", "note": "A1 seed 43", "status": "pending", "seed": 43, "val_bpb": 1.3541419495716576, "training_seconds": 300.41149497032166, "startup_seconds": 1.3774304389953613, "mfu_percent": 28.75081707677661, "total_tokens_M": 151.781376, "num_steps": 579, "depth": 4, "num_params": 11534472, "num_params_M": 11.534472, "peak_vram_mb": 15855.05810546875, "total_seconds": 330.94778752326965, "peak_vram_gb": 15.483455181121826, "score": 1.3541419495716576, "goal": "min_bpb", "time_budget": 300, "eval_tokens": 20971520}
{"timestamp": "2026-08-04T16:20:01", "commit": "3010f51", "branch": "testing1", "note": "A1 seed 44", "status": "pending", "seed": 44, "val_bpb": 1.3659957454457878, "training_seconds": 300.1463041305542, "startup_seconds": 1.3184998035430908, "mfu_percent": 28.7831187658786, "total_tokens_M": 152.04352, "num_steps": 580, "depth": 4, "num_params": 11534472, "num_params_M": 11.534472, "peak_vram_mb": 15855.05810546875, "total_seconds": 330.4707646369934, "peak_vram_gb": 15.483455181121826, "score": 1.3659957454457878, "goal": "min_bpb", "time_budget": 300, "eval_tokens": 20971520}
{"timestamp": "2026-08-04T17:41:18", "commit": "3010f51", "branch": "testing1", "note": "A1 seed 45", "status": "pending", "seed": 45, "val_bpb": 1.3165710431138422, "training_seconds": 300.1829662322998, "startup_seconds": 1.2752666473388672, "mfu_percent": 28.758962388378865, "total_tokens_M": 152.567808, "num_steps": 582, "depth": 4, "num_params": 11534472, "num_params_M": 11.534472, "peak_vram_mb": 15855.05810546875, "total_seconds": 330.50102639198303, "peak_vram_gb": 15.483455181121826, "score": 1.3165710431138422, "goal": "min_bpb", "time_budget": 300, "eval_tokens": 20971520}
{"timestamp": "2026-08-05T05:09:26", "commit": "3010f51", "branch": "testing1", "note": "A3 determinism 1", "status": "pending", "seed": 42, "val_bpb": 1.345164990515031, "training_seconds": 300.3075714111328, "startup_seconds": 1.4158310890197754, "mfu_percent": 29.27222039521255, "total_tokens_M": 151.781376, "num_steps": 579, "depth": 4, "num_params": 11534472, "num_params_M": 11.534472, "peak_vram_mb": 15855.05810546875, "total_seconds": 330.6828758716583, "peak_vram_gb": 15.483455181121826, "score": 1.345164990515031, "goal": "min_bpb", "time_budget": 300, "eval_tokens": 20971520}
{"timestamp": "2026-08-05T05:15:15", "commit": "3010f51", "branch": "testing1", "note": "A3 determinism 2", "status": "pending", "seed": 42, "val_bpb": 1.3451713770226708, "training_seconds": 300.45945739746094, "startup_seconds": 1.304513692855835, "mfu_percent": 29.2451287983313, "total_tokens_M": 151.519232, "num_steps": 578, "depth": 4, "num_params": 11534472, "num_params_M": 11.534472, "peak_vram_mb": 15855.05810546875, "total_seconds": 330.80554151535034, "peak_vram_gb": 15.483455181121826, "score": 1.3451713770226708, "goal": "min_bpb", "time_budget": 300, "eval_tokens": 20971520}
{"timestamp": "2026-08-05T05:21:03", "commit": "3010f51", "branch": "testing1", "note": "A2 eval_tokens=2621440", "status": "pending", "seed": 42, "val_bpb": 1.329731674972376, "training_seconds": 300.003981590271, "startup_seconds": 1.353823184967041, "mfu_percent": 29.053032775826612, "total_tokens_M": 151.257088, "num_steps": 577, "depth": 4, "num_params": 11534472, "num_params_M": 11.534472, "peak_vram_mb": 15855.05810546875, "total_seconds": 313.0875732898712, "peak_vram_gb": 15.483455181121826, "score": 1.329731674972376, "goal": "min_bpb", "time_budget": 300, "eval_tokens": 2621440}
{"timestamp": "2026-08-05T05:26:44", "commit": "3010f51", "branch": "testing1", "note": "A2 eval_tokens=5242880", "status": "pending", "seed": 42, "val_bpb": 1.3259236616713994, "training_seconds": 300.114305973053, "startup_seconds": 1.2980165481567383, "mfu_percent": 29.005440887644106, "total_tokens_M": 151.257088, "num_steps": 577, "depth": 4, "num_params": 11534472, "num_params_M": 11.534472, "peak_vram_mb": 15855.05810546875, "total_seconds": 315.6088328361511, "peak_vram_gb": 15.483455181121826, "score": 1.3259236616713994, "goal": "min_bpb", "time_budget": 300, "eval_tokens": 5242880}
{"timestamp": "2026-08-05T05:33:14", "commit": "3010f51", "branch": "testing1", "note": "A2 eval_tokens=10485760", "status": "pending", "seed": 42, "val_bpb": 1.330759199596481, "training_seconds": 300.26935172080994, "startup_seconds": 1.339752435684204, "mfu_percent": 29.26354271786782, "total_tokens_M": 151.257088, "num_steps": 577, "depth": 4, "num_params": 11534472, "num_params_M": 11.534472, "peak_vram_mb": 15855.05810546875, "total_seconds": 320.9582917690277, "peak_vram_gb": 15.483455181121826, "score": 1.330759199596481, "goal": "min_bpb", "time_budget": 300, "eval_tokens": 10485760}
{"timestamp": "2026-08-05T05:39:28", "commit": "3010f51", "branch": "testing1", "note": "A2 eval_tokens=20971520", "status": "pending", "seed": 42, "val_bpb": 1.3377097401716025, "training_seconds": 300.4957401752472, "startup_seconds": 1.3709125518798828, "mfu_percent": 29.31088346924478, "total_tokens_M": 151.257088, "num_steps": 577, "depth": 4, "num_params": 11534472, "num_params_M": 11.534472, "peak_vram_mb": 15855.05810546875, "total_seconds": 331.03935384750366, "peak_vram_gb": 15.483455181121826, "score": 1.3377097401716025, "goal": "min_bpb", "time_budget": 300, "eval_tokens": 20971520}
{"timestamp": "2026-08-05T06:39:35", "commit": "8eedb92", "branch": "testing1", "note": "C1 warmup=0.01", "status": "keep", "seed": 42, "val_bpb": 1.2958534125409376, "training_seconds": 300.4042766094208, "startup_seconds": 1.3956992626190186, "mfu_percent": 28.675056876513036, "total_tokens_M": 151.781376, "num_steps": 579, "depth": 4, "num_params": 11534472, "num_params_M": 11.534472, "peak_vram_mb": 15855.05810546875, "total_seconds": 330.7957413196564, "peak_vram_gb": 15.483455181121826, "score": 1.2958534125409376, "goal": "min_bpb", "time_budget": 300, "eval_tokens": 20971520}
{"timestamp": "2026-08-05T06:55:16", "commit": "969fa49", "branch": "testing1", "note": "C1 warmup=0.02", "status": "discard", "seed": 42, "val_bpb": 1.3169494881531816, "training_seconds": 300.0576229095459, "startup_seconds": 1.4335999488830566, "mfu_percent": 28.65973450306029, "total_tokens_M": 150.994944, "num_steps": 576, "depth": 4, "num_params": 11534472, "num_params_M": 11.534472, "peak_vram_mb": 15855.05810546875, "total_seconds": 330.6554365158081, "peak_vram_gb": 15.483455181121826, "score": 1.3169494881531816, "goal": "min_bpb", "time_budget": 300, "eval_tokens": 20971520}
{"timestamp": "2026-08-05T07:05:07", "commit": "65fb5cf", "branch": "testing1", "note": "C1 warmup=0.05", "status": "discard", "seed": 42, "val_bpb": 1.3145594103518439, "training_seconds": 300.3230679035187, "startup_seconds": 1.3748810291290283, "mfu_percent": 29.76668656548155, "total_tokens_M": 151.519232, "num_steps": 578, "depth": 4, "num_params": 11534472, "num_params_M": 11.534472, "peak_vram_mb": 15855.05810546875, "total_seconds": 330.8720426559448, "peak_vram_gb": 15.483455181121826, "score": 1.3145594103518439, "goal": "min_bpb", "time_budget": 300, "eval_tokens": 20971520}
{"timestamp": "2026-08-05T07:30:03", "commit": "51be58b", "branch": "testing1", "note": "C1 warmup=0.10", "status": "discard", "seed": 42, "val_bpb": 1.3325209971730367, "training_seconds": 300.53780007362366, "startup_seconds": 1.3706436157226562, "mfu_percent": 28.486630907768962, "total_tokens_M": 151.781376, "num_steps": 579, "depth": 4, "num_params": 11534472, "num_params_M": 11.534472, "peak_vram_mb": 15855.05810546875, "total_seconds": 331.04770827293396, "peak_vram_gb": 15.483455181121826, "score": 1.3325209971730367, "goal": "min_bpb", "time_budget": 300, "eval_tokens": 20971520}
{"timestamp": "2026-08-05T07:45:23", "commit": "05c1a73", "branch": "testing1", "note": "B1 depth=2", "status": "discard", "seed": 42, "val_bpb": 1.3391598480085865, "training_seconds": 300.02207350730896, "startup_seconds": 1.3919312953948975, "mfu_percent": 18.21506719013661, "total_tokens_M": 356.253696, "num_steps": 1359, "depth": 2, "num_params": 3538980, "num_params_M": 3.53898, "peak_vram_mb": 7109.2705078125, "total_seconds": 332.0194070339203, "peak_vram_gb": 6.9426469802856445, "score": 1.3391598480085865, "goal": "min_bpb", "time_budget": 300, "eval_tokens": 20971520}
{"timestamp": "2026-08-05T07:53:31", "commit": "fbf8e31", "branch": "testing1", "note": "B1 depth=3", "status": "keep", "seed": 42, "val_bpb": 1.1956544292293538, "training_seconds": 300.24261379241943, "startup_seconds": 1.3359897136688232, "mfu_percent": 28.154399683293015, "total_tokens_M": 183.238656, "num_steps": 699, "depth": 3, "num_params": 10748038, "num_params_M": 10.748038, "peak_vram_mb": 13023.54541015625, "total_seconds": 336.24699234962463, "peak_vram_gb": 12.718306064605713, "score": 1.1956544292293538, "goal": "min_bpb", "time_budget": 300, "eval_tokens": 20971520}
{"timestamp": "2026-08-05T08:27:30", "commit": "4df3110", "branch": "testing1", "note": "B1 depth=6", "status": "discard", "seed": 42, "val_bpb": 1.2028330395333324, "training_seconds": 300.22026085853577, "startup_seconds": 1.3863894939422607, "mfu_percent": 36.53750468738366, "total_tokens_M": 76.808192, "num_steps": 293, "depth": 6, "num_params": 26345772, "num_params_M": 26.345772, "peak_vram_mb": 30430.87060546875, "total_seconds": 366.9921078681946, "peak_vram_gb": 29.717647075653076, "score": 1.2028330395333324, "goal": "min_bpb", "time_budget": 300, "eval_tokens": 20971520}
{"timestamp": "2026-08-05T08:35:10", "commit": "6ff4280", "branch": "testing1", "note": "B1 depth=8", "status": "discard", "seed": 42, "val_bpb": 1.2481144191562266, "training_seconds": 301.6583294868469, "startup_seconds": 1.3297581672668457, "mfu_percent": 40.3491099365844, "total_tokens_M": 45.350912, "num_steps": 173, "depth": 8, "num_params": 50332176, "num_params_M": 50.332176, "peak_vram_mb": 50859.2060546875, "total_seconds": 392.1416742801666, "peak_vram_gb": 49.66719341278076, "score": 1.2481144191562266, "goal": "min_bpb", "time_budget": 300, "eval_tokens": 20971520}
{"timestamp": "2026-08-05T08:41:25", "commit": "cd7fdbe", "branch": "testing1", "note": "C7 total_batch=2^16", "status": "discard", "seed": 42, "val_bpb": 1.1839863447333743, "training_seconds": 300.0317294597626, "startup_seconds": 1.280379295349121, "mfu_percent": 28.002257962934753, "total_tokens_M": 175.767552, "num_steps": 2682, "depth": 3, "num_params": 10748038, "num_params_M": 10.748038, "peak_vram_mb": 3375.54541015625, "total_seconds": 331.92120122909546, "peak_vram_gb": 3.296431064605713, "score": 1.1839863447333743, "goal": "min_bpb", "time_budget": 300, "eval_tokens": 20971520}
{"timestamp": "2026-08-05T20:16:16", "commit": "71a96fa", "branch": "testing1", "note": "C7 total_batch=2^17", "status": "discard", "seed": 42, "val_bpb": 1.1837203659125306, "training_seconds": 300.025892496109, "startup_seconds": 1.238354206085205, "mfu_percent": 27.701988662264267, "total_tokens_M": 179.961856, "num_steps": 1373, "depth": 3, "num_params": 10748038, "num_params_M": 10.748038, "peak_vram_mb": 6591.54541015625, "total_seconds": 332.6321084499359, "peak_vram_gb": 6.437056064605713, "score": 1.1837203659125306, "goal": "min_bpb", "time_budget": 300, "eval_tokens": 20971520}
{"timestamp": "2026-08-05T20:53:32", "commit": "f912546", "branch": "testing1", "note": "C7 total_batch=2^19", "status": "discard", "seed": 42, "val_bpb": 1.2239339851638251, "training_seconds": 300.14368963241577, "startup_seconds": 1.7994201183319092, "mfu_percent": 28.455226276749197, "total_tokens_M": 182.452224, "num_steps": 348, "depth": 3, "num_params": 10748038, "num_params_M": 10.748038, "peak_vram_mb": 25887.54638671875, "total_seconds": 342.3719336986542, "peak_vram_gb": 25.28080701828003, "score": 1.2239339851638251, "goal": "min_bpb", "time_budget": 300, "eval_tokens": 20971520}
{"timestamp": "2026-08-05T20:59:43", "commit": "3ff7d80", "branch": "testing1", "note": "C4 matrix_lr=0.02", "status": "discard", "seed": 42, "val_bpb": 1.2001892426203307, "training_seconds": 300.16120409965515, "startup_seconds": 1.5435729026794434, "mfu_percent": 28.7387045400188, "total_tokens_M": 180.87936, "num_steps": 690, "depth": 3, "num_params": 10748038, "num_params_M": 10.748038, "peak_vram_mb": 13023.54541015625, "total_seconds": 327.99346828460693, "peak_vram_gb": 12.718306064605713, "score": 1.2001892426203307, "goal": "min_bpb", "time_budget": 300, "eval_tokens": 20971520}
{"timestamp": "2026-08-06T04:41:42", "commit": "f3d374a", "branch": "testing1", "note": "C4 matrix_lr=0.03", "status": "discard", "seed": 42, "val_bpb": 1.1964497512386154, "training_seconds": 300.25565457344055, "startup_seconds": 1.2963528633117676, "mfu_percent": 27.858652161156986, "total_tokens_M": 182.452224, "num_steps": 696, "depth": 3, "num_params": 10748038, "num_params_M": 10.748038, "peak_vram_mb": 13023.54541015625, "total_seconds": 327.99698209762573, "peak_vram_gb": 12.718306064605713, "score": 1.1964497512386154, "goal": "min_bpb", "time_budget": 300, "eval_tokens": 20971520}
{"timestamp": "2026-08-06T04:54:53", "commit": "39ca991", "branch": "testing1", "note": "C4 matrix_lr=0.06", "status": "discard", "seed": 42, "val_bpb": 1.1938821259690098, "training_seconds": 300.0908341407776, "startup_seconds": 1.3381285667419434, "mfu_percent": 28.650688389885005, "total_tokens_M": 185.335808, "num_steps": 707, "depth": 3, "num_params": 10748038, "num_params_M": 10.748038, "peak_vram_mb": 13023.54541015625, "total_seconds": 326.7857234477997, "peak_vram_gb": 12.718306064605713, "score": 1.1938821259690098, "goal": "min_bpb", "time_budget": 300, "eval_tokens": 20971520}
{"timestamp": "2026-08-06T05:22:35", "commit": "19d6df2", "branch": "testing1", "note": "C4 matrix_lr=0.08", "status": "discard", "seed": 42, "val_bpb": 1.1966773961043142, "training_seconds": 300.41648054122925, "startup_seconds": 1.300846815109253, "mfu_percent": 28.888021690095833, "total_tokens_M": 185.335808, "num_steps": 707, "depth": 3, "num_params": 10748038, "num_params_M": 10.748038, "peak_vram_mb": 13023.54541015625, "total_seconds": 327.142941236496, "peak_vram_gb": 12.718306064605713, "score": 1.1966773961043142, "goal": "min_bpb", "time_budget": 300, "eval_tokens": 20971520}
{"timestamp": "2026-08-06T05:29:36", "commit": "bf91cb4", "branch": "testing1", "note": "G1 no attention (pre-fix duplicate, superseded)", "status": "crash", "seed": 42, "val_bpb": NaN, "training_seconds": 300.06907176971436, "startup_seconds": 1.388855218887329, "mfu_percent": 46.664503321444045, "total_tokens_M": 298.057728, "num_steps": 1137, "depth": 3, "num_params": 10748038, "num_params_M": 10.748038, "peak_vram_mb": 9236.02880859375, "total_seconds": 321.43398904800415, "peak_vram_gb": 9.019559383392334, "score": NaN, "goal": "min_bpb", "time_budget": 300, "eval_tokens": 20971520}
{"timestamp": "2026-08-06T05:41:55", "commit": "bf91cb4", "branch": "testing1", "note": "G1 diag (off-protocol diagnostic, non-standard time_budget, not a real experiment)", "status": "crash", "seed": 42, "val_bpb": NaN, "training_seconds": 20.098564386367798, "startup_seconds": 1.3043591976165771, "mfu_percent": 47.09219749496737, "total_tokens_M": 22.806528, "num_steps": 87, "depth": 3, "num_params": 10748038, "num_params_M": 10.748038, "peak_vram_mb": 9236.02880859375, "total_seconds": 39.742143630981445, "peak_vram_gb": 9.019559383392334, "score": NaN, "goal": "min_bpb", "time_budget": 20, "eval_tokens": 20971520}
{"timestamp": "2026-08-06T05:44:21", "commit": "bf91cb4", "branch": "testing1", "note": "G1 diag2 (off-protocol diagnostic, non-standard time_budget, not a real experiment)", "status": "crash", "seed": 42, "val_bpb": 1.9972066007602471, "training_seconds": 10.089679718017578, "startup_seconds": 1.4233229160308838, "mfu_percent": 24.379922091139925, "total_tokens_M": 7.86432, "num_steps": 30, "depth": 3, "num_params": 10748038, "num_params_M": 10.748038, "peak_vram_mb": 25618.02978515625, "total_seconds": 55.04132270812988, "peak_vram_gb": 25.01760721206665, "score": 1.9972066007602471, "goal": "min_bpb", "time_budget": 10, "eval_tokens": 20971520}
{"timestamp": "2026-08-06T05:46:15", "commit": "bf91cb4", "branch": "testing1", "note": "G1 diag3 (off-protocol diagnostic, non-standard time_budget, not a real experiment)", "status": "crash", "seed": 42, "val_bpb": 1.8723189262860647, "training_seconds": 60.06189036369324, "startup_seconds": 1.3676633834838867, "mfu_percent": 23.81709862058804, "total_tokens_M": 32.505856, "num_steps": 124, "depth": 3, "num_params": 10748038, "num_params_M": 10.748038, "peak_vram_mb": 25618.02978515625, "total_seconds": 96.61366486549377, "peak_vram_gb": 25.01760721206665, "score": 1.8723189262860647, "goal": "min_bpb", "time_budget": 60, "eval_tokens": 20971520}
{"timestamp": "2026-08-06T05:50:20", "commit": "bf91cb4", "branch": "testing1", "note": "G1 diag4 (off-protocol diagnostic, non-standard time_budget, not a real experiment)", "status": "crash", "seed": 42, "val_bpb": 1.923464111391152, "training_seconds": 20.06705951690674, "startup_seconds": 1.2927453517913818, "mfu_percent": 24.16011810096244, "total_tokens_M": 12.845056, "num_steps": 49, "depth": 3, "num_params": 10748038, "num_params_M": 10.748038, "peak_vram_mb": 25618.02978515625, "total_seconds": 56.34702444076538, "peak_vram_gb": 25.01760721206665, "score": 1.923464111391152, "goal": "min_bpb", "time_budget": 20, "eval_tokens": 20971520}
{"timestamp": "2026-08-06T05:56:20", "commit": "bf91cb4", "branch": "testing1", "note": "G1 diag5 (off-protocol diagnostic, non-standard time_budget, not a real experiment)", "status": "crash", "seed": 42, "val_bpb": 1.8451726096471943, "training_seconds": 300.259482383728, "startup_seconds": 1.3954808712005615, "mfu_percent": 23.581067211712245, "total_tokens_M": 151.257088, "num_steps": 577, "depth": 3, "num_params": 10748038, "num_params_M": 10.748038, "peak_vram_mb": 25618.02978515625, "total_seconds": 336.96025466918945, "peak_vram_gb": 25.01760721206665, "score": 1.8451726096471943, "goal": "min_bpb", "time_budget": 300, "eval_tokens": 20971520}
{"timestamp": "2026-08-06T06:27:04", "commit": "e5e030e", "branch": "testing1", "note": "G1 no attention", "status": "crash", "seed": 42, "val_bpb": NaN, "training_seconds": 300.22773933410645, "startup_seconds": 1.4101874828338623, "mfu_percent": 46.81050901955559, "total_tokens_M": 298.582016, "num_steps": 1139, "depth": 3, "num_params": 10748038, "num_params_M": 10.748038, "peak_vram_mb": 9236.02880859375, "total_seconds": 320.3606436252594, "peak_vram_gb": 9.019559383392334, "score": NaN, "goal": "min_bpb", "time_budget": 300, "eval_tokens": 20971520}
{"timestamp": "2026-08-06T06:42:41", "commit": "b4895fb", "branch": "testing1", "note": "B5 drop value embeddings", "status": "discard", "seed": 42, "val_bpb": 1.3841200353914116, "training_seconds": 300.36510372161865, "startup_seconds": 1.3092231750488281, "mfu_percent": 29.66230692530957, "total_tokens_M": 190.316544, "num_steps": 726, "depth": 3, "num_params": 6553606, "num_params_M": 6.553606, "peak_vram_mb": 12709.54248046875, "total_seconds": 330.4483411312103, "peak_vram_gb": 12.411662578582764, "score": 1.3841200353914116, "goal": "min_bpb", "time_budget": 300, "eval_tokens": 20971520}
